name,description,url,source,category
GoCharlie,"A cost-effective alternative to big-time AI content creators. It crafts distinctive content, offers personalized writing suggestions, streamlines social media posting, and optimizes SEO while freeing you from monotonous copy-pasting. Where versatility meets value.",https://link.aitoolsdirectory.com/gocharlie,https://aitoolsdirectory.com,Copywriting
Marketmuse,"MarketMuse is a content optimization tool with ChatGPT built in. Helps SEO professionals create well-crafted, SEO-focused articles. MarketMuse uses advanced AI algorithms to optimize content for SEO. By analyzing thousands of pages, it suggests semantically linked topics, relevant questions, and appropriate internal links.",https://link.aitoolsdirectory.com/marketmuse,https://aitoolsdirectory.com,SEO#content marketing
Black Friday Deals,"Whether you’re a start-up seeking competitive advantages, an entrepreneur aiming to maximize efficiency, or simply an AI enthusiast keeping up with trends, we’ve gathered 2025’s best deals on AI tools for you.",https://aitoolsdirectory.com/black-friday,https://aitoolsdirectory.com,Deals
Sanebox,"SaneBox identifies important messages, but it also hides distractions, banishes annoying senders, and reminds you of emails that need a response. Make sure only important emails reach your inbox.",https://link.aitoolsdirectory.com/sanebox,https://aitoolsdirectory.com,Productivity
Podium,Podium is an AI-powered copywriter for podcasts. Its unique combination of public AI tools with proprietary tech saves podcasters money and allows them to reach a wider audience—all the while automating their podcast production process.,https://link.aitoolsdirectory.com/podium,https://aitoolsdirectory.com,Podcasting
PromptPal,"Innovative tools to help users create engaging prompts for AI platforms like ChatGPT, making their interactions more effective, enjoyable, and geared towards productivity",https://link.aitoolsdirectory.com/promptpal,https://aitoolsdirectory.com,Productivity#prompts
Looka,"Looka leverages AI to create unique, customizable logo designs that reflect your brand's individuality and can be vividly projected onto various merchandise. No specialist technical design skills required.",https://link.aitoolsdirectory.com/looka,https://aitoolsdirectory.com,Graphic Design
Nekton AI,"Automate day-to-day business and personal tasks with Nekton AI's plain English workflow. Integrate with thousands of services, build product prototypes, collect user feedback, customize automation tasks, and mix manual and automated steps.",https://link.aitoolsdirectory.com/nekton,https://aitoolsdirectory.com,Marketing
CourseAI,"Build an online course with an AI assistant that does topic generation, niche selection, module content creation, and quiz generation. Enhance your course with video scripts, voice-overs, and marketing tools automatically.",https://link.aitoolsdirectory.com/courseai,https://aitoolsdirectory.com,Marketing
tinyEinstein,"Marketing automation, messaging, and pro-level email marketing with tailor-made templates, one-click complex automations, and automatic email capture for Shopify store owners.",https://link.aitoolsdirectory.com/tinyeinstein,https://aitoolsdirectory.com,Marketing
WellSaid Labs,"AI-based voice generator, effortlessly converts text into speech, offering versatile and captivating voiceovers. Widely trusted, including by industry giants such as Boeing and Peloton, it facilitates multi-collaborator updates, mimics human speech nuances for natural sounding voiceovers.",https://link.aitoolsdirectory.com/wellsaid,https://aitoolsdirectory.com,Audio
Research Studio,"Research Studio was created to help small businesses with limited UX and marketing budgets automate research analysis. It cuts user and customer research time by almost 2 thirds, providing an affordable solution without sacrificing quality.",https://researchstudio.ai/?via=aitoolsdirectory-com,https://aitoolsdirectory.com,Productivity
Profile Pic Maker,"Elevate your profile game with PFPMaker: upload your finest shots, explore various styles, and stand out with a unique blend of creativity and personal flair!",https://pfpmaker.com/?via=aitoolsdirectory-com,https://aitoolsdirectory.com,Generative Art
SUPERMACHINE,"SUPERMACHINE is a swift and user-friendly AI tool that empowers users to generate diverse, one-of-a-kind, commercially-usable, AI-generated images just from simple descriptions.",https://link.aitoolsdirectory.com/supermachine,https://aitoolsdirectory.com,Generative Art
Chaindesk,"Chaindesk offers a unique, no-code, AI chatbot solution customized to your specific data for improved business operations. Have intelligent interactions with your documents and offer multilingual support to customers.",https://link.aitoolsdirectory.com/chaindesk,https://aitoolsdirectory.com,Chat#websites #chatbot #nocode
tl;dv,"Streamline your meetings and enhance collaboration with tl;dv's automated recording, transcription, and summarization features. Capture and document important points from every meeting.",https://link.aitoolsdirectory.com/tldv,https://aitoolsdirectory.com,Productivity
Easy Peasy,"Easy content and image creation with a GPT-4 chatbot which intelligently interacts, fetches URLs, and transcribes speech with precision, offering a slick AI-enhanced digital experience.",https://link.aitoolsdirectory.com/easypeasy,https://aitoolsdirectory.com,Copywriting
Notion AI,Notion's AI writing assistant is already embedded in the world's most popular productivity app. It can write entire blog posts or brainstorm ideas. And the AI's capabilities will expand to project management and other areas of productivity and workflow later.,https://link.aitoolsdirectory.com/notion,https://aitoolsdirectory.com,Productivity
Text Cortex,"Generate copy for marketing, sales, and websites in your browser. Summarize pages in seconds. Fix grammar issues and and speed up your writing process. Integrate with 1000+ platforms.",https://link.aitoolsdirectory.com/textcortex,https://aitoolsdirectory.com,Copywriting
Remove BG,"Thanks to remove.bg's clever artificial intelligence, you can quickly and easily remove backgrounds from images in 5 seconds or less.",https://link.aitoolsdirectory.com/removebg,https://aitoolsdirectory.com,Image Editing#background
Pixlr,"Pixlr is an advanced, web-based graphic design and photo editor with AI-powered features to help you create pro graphics and designs quickly. Remove backgrounds, adjust the look, remove blemishes, and turn your photos into painted ar",https://link.aitoolsdirectory.com/pixlr,https://aitoolsdirectory.com,Image Editing#art #graphics
Spikes Studio,"Convert long videos into shorter clips for platforms like YouTube, TikTok, and Instagram Reels. Automatically Identify the best moments in your videos, remove the boring parts, and add features like automatic captions, keyword highlighting, hashtags, and descriptions.",https://link.aitoolsdirectory.com/spikes,https://aitoolsdirectory.com,Video Generation
Writesonic,"Writesonic's new on-brand AI writer meticulously mirrors your brand's voice while delivering fact-checked, SEO-friendly content, all with a no-plagiarism guarantee. . The unlimited plan is 20% cheaper than ChatGPT and 50% cheaper than Jasper.",https://link.aitoolsdirectory.com/writesonic-aiwriter,https://aitoolsdirectory.com,Copywriting#writing #assistant
Quizgecko,"Effortlessly create and analyze quizzes and flashcards from text, URLs, or YouTube videos, supporting multiple formats, languages, and files with useful feedback and time-saving features.",https://link.aitoolsdirectory.com/quizgecko,https://aitoolsdirectory.com,Education#quiz #entertainment
Creatr,"Get over 70 of the best AI-based templates for creating article content, blog ideas, blog post intros, ad copy titles, sales page sections, and conclusions. Use chat assistants to automate ecommerce, improve social media presence. Generate captions and hashtags along with scripts!",https://link.aitoolsdirectory.com/creatr,https://aitoolsdirectory.com,Copywriting
Squirrly SEO,"An an all-in-one SEO plugin for WordPress with a new AI content creation feature that builds prompts based on context, right inside of WordPress. You also get keyword research, content optimization, SEO optimization features, technical SEO fixes and suggestions, site audits, rank tracking, and more.",https://link.aitoolsdirectory.com/squirrlyseo,https://aitoolsdirectory.com,SEO#SEO #WordPress
CopySpace,"CopySpace is one of the easiest-to-use and most efficient AI copywriting editors for crafting high ROI marketing blogs and copy. It uses advanced copywriting models, supports over 100 languages, offers quick content creation of up to 8000 words, and features over 100 ready-made blogging & marketing tools",https://link.aitoolsdirectory.com/copyspace,https://aitoolsdirectory.com,Copywriting
ChatGPT,"AI language model ChatGPT is able to answer your questions, provide insightful information, and engage in witty banter. As an impartial and unbiased machine, ChatGPT can offer objective advice and perspectives. Aside from quick and accurate responses, it has a vast knowledge base and can entertain and educate at the same time.",https://chat.openai.com/?via=aitoolsdirectory-com,https://aitoolsdirectory.com,Chat#LLM #chatbot
Rytr,Rtyr is the perfect assistant for brainstorming and writing content. And Rytr also now includes an AI image generation tool to accompany your writing.,https://link.aitoolsdirectory.com/rytr,https://aitoolsdirectory.com,Copywriting#writing #assistant
Linguix,"Linguix is a productivity tool that helps you write better by automatically checking grammar, punctuation, and style using AI-based language NLP",https://link.aitoolsdirectory.com/linguix,https://aitoolsdirectory.com,Copywriting#writing #assistant
Tailwind Ghostwriter,"Tailwind App reclaims the scheduling tool throne with its new Ghostwriter feature, offering versatile AI-powered copywriting for SEO, ads, and social media content, saving you time and boosting your marketing game.",https://link.aitoolsdirectory.com/tailwind,https://aitoolsdirectory.com,Social Media
Play.ht,"Transform your text into natural-sounding speech. Create voiceovers for videos, podcasts, & e-learning and use the Text to Speech API to integrate voice synthesis into your applications.",https://link.aitoolsdirectory.com/playht,https://aitoolsdirectory.com,Text-to-Voice
Lovo,"AI voiceover and text to speech platform gives you the ability to create realistic, human-like voices for your project with pronunciation editing, voice speed controls, and voice emotion manipulation.",https://link.aitoolsdirectory.com/lovo,https://aitoolsdirectory.com,Text-to-Voice#voice
HookSounds AI Studio,"Make custom, mood-aligned soundtracks for your videos with AI Studio. Instantly analyze your video's unique characteristics and produce smart-synced music, eliminating manual editing. Keep refining until you hit the perfect note.",https://link.aitoolsdirectory.com/hooksounds,https://aitoolsdirectory.com,Music
Feathery,"Create elegant online forms with unparalleled speed, all while offering deep customization and seamless integration. From intuitive design tools to advanced form logic, Feathery AI is changing the form-building market.",https://link.aitoolsdirectory.com/feathery,https://aitoolsdirectory.com,Productivity#forms #onboarding
Adalo,"Adalo makes no-code mobile app creation easy by integrating OpenAI's ChatGPT for an enriched user experience. Define your concept with Adalo's ""Magic tools"", click generate and presto - your professional-looking database is ready",https://link.aitoolsdirectory.com/adalo,https://aitoolsdirectory.com,NoCode
Luna,"Send personalized emails that get replies with Luna, AI-powered email marketing software that suggests high-quality leads and automates the sending of personalized emails.",https://link.aitoolsdirectory.com/luna,https://aitoolsdirectory.com,Copywriting
MagicReply,"MagicReply blends artificial intelligence and human expertise to provide speedy and precise customer service in multiple languages. Leveraging past interactions, it enables agents to deliver exceptional support while seamlessly handling their workloads",https://link.aitoolsdirectory.com/crispchat,https://aitoolsdirectory.com,Chat
Typeshare,"Crack the creativity conundrum with Typeshare's Endless Idea Generator. By simply entering a topic, harness the power of AI to instantly turn thoughts into a multitude of ideas, streamlining the writing process.",https://link.aitoolsdirectory.com/typeshare,https://aitoolsdirectory.com,Copywriting
Typing Mind,"TypingMind, an AI-enhanced tool, marries a superior user interface with ChatGPT's capabilities, offering features like ""chat with PDF"", custom saved prompts, web search, local chat history storage, and the ability to switch AI models instantly.",https://typingmind.com?via=aitoolsdirectory-com,https://aitoolsdirectory.com,Chat
Zigpoll,"Speedy, multilingual, AI-enhanced survey app that's changing how you gain insights, optimize your business, and stay ahead of customer trends.",https://link.aitoolsdirectory.com/zigpoll,https://aitoolsdirectory.com,Marketing
Eclipse AI,"Eclipse AI simplifies customer understanding and retention by consolidating various data sources, revealing actionable insights, and facilitating custom or integrated surveys, helping businesses effectively address customer issues and improve retention.",https://eclipse-ai.com/,https://aitoolsdirectory.com,Productivity
GetResponse,AI Email Generator: Create engaging emails in record time with an AI-powered email generator. Boost your email marketing with industry-optimized subject lines and content.,https://link.aitoolsdirectory.com/getresponse-ai,https://aitoolsdirectory.com,Marketing
Quillbot,"Quillbot's natural language processing and machine learning tools suggest rephrasing and other improvements to text. Use it to brainstorm ideas, generate summaries, and even create unique articles and essays.",https://link.aitoolsdirectory.com/quillbot,https://aitoolsdirectory.com,Copywriting#writing #assistant
Lunacy by Icons8,"Lunacy is a free, versatile UX/UI design app for macOS, Windows, and Linux. It offers AI tools, custom graphics, Figma imports, online/offline modes, prototyping, live webpage editing, and enhanced image manipulation features.",https://link.aitoolsdirectory.com/icons8-lunacy,https://aitoolsdirectory.com,Graphic Design
Tugan,"Generative marketing tool that redefines content creation, transforming URLs into sales or email copy, and offering an efficient alternative to writing from scratch.",https://link.aitoolsdirectory.com/tugan,https://aitoolsdirectory.com,Copywriting
Parsio,"Automate data extraction from various documents, streamlining your business while cutting costs and boosting efficiency.",https://link.aitoolsdirectory.com/parsio,https://aitoolsdirectory.com,Productivity
StoryNest,"StoryNest.ai provides AI-driven editing and proofreading tools, helping writers refine interactive stories with grammar, style, and clarity enhancements, ensuring engaging, polished narratives.",https://link.aitoolsdirectory.com/storynest,https://aitoolsdirectory.com,Generative Text
Artsmart AI,Create visual content that's straight-up stunning without breaking a sweat by entering prompts or simply uploading a photo and watch as the AI produces artwork based on the input.,https://link.aitoolsdirectory.com/artsmart,https://aitoolsdirectory.com,Generative Art#art #graphics
Simple Phones,"SimplePhones is an AI-powered virtual agent ready to handle all your business's telecommunication needs. You can forward or route calls to multiple numbers, send texts or emails to team members with customer requirements, and log calls and transcripts for an in-depth look into customers' behavior",https://link.aitoolsdirectory.com/simplephones,https://aitoolsdirectory.com,Productivity
Notion AI,Notion's AI writing assistant is already embedded in the world's most popular productivity app. It can write entire blog posts or brainstorm ideas. And the AI's capabilities will expand to project management and other areas of productivity and workflow later.,https://link.aitoolsdirectory.com/notion,https://aitoolsdirectory.com,Productivity
Steve AI,"A versatile video creation wizard, effortlessly automating scripting, editing, and publishing while transforming text, voice, and photos into vibrant videos, with access to expansive media libraries and the power to convert audio files into dynamic content.",https://www.steve.ai/?via=aitoolsdirectory-com,https://aitoolsdirectory.com,Text-to-Video
Mubert,"Mubert is a music app that makes it easy for content creators, artists, developers and brands to create the perfect soundtrack for their content.",https://link.aitoolsdirectory.com/mubert,https://aitoolsdirectory.com,Music#audiocreation #music
GPTkit,"GPTKit is a free, easy-to-use AI text generation detection tool that uses six different methods to accurately identify and classify machine-generated text. It provides reports on the authenticity and reality of the content analyzed",https://link.aitoolsdirectory.com/gptkit,https://aitoolsdirectory.com,AI Detection
Cheatlayer,"CheatLayer's AI-powered platform automates business tasks with a language interface. Create apps, games, and websites in minutes, automate social media posting, and enjoy unlimited scraper cheat codes. The custom-trained GPT-4 model, Project Atlas, streamlines complex automation challenges.",https://link.aitoolsdirectory.com/cheatlayer,https://aitoolsdirectory.com,Productivity
Process AI,The world's first Process Management Platform powered by AI. Transform manual processes into AI-driven workflows.,https://link.aitoolsdirectory.com/process-st,https://aitoolsdirectory.com,Productivity
Brain FM,"Brain.fm provides scientifically proven, patented AI-generated music for focus, relaxation, and sleep. The tailored music stimulates the brain while blending into the background allowing you to manage your energy levels and get more done.",https://link.aitoolsdirectory.com/brainfm,https://aitoolsdirectory.com,Productivity
Hexometer,"Hexometer's sophisticated AI platform monitors your website 24/7 to catch availability, performance, UX, SEO, and server health problems before they lead to a loss in traffic and lost revenue.",https://link.aitoolsdirectory.com/hexometer,https://aitoolsdirectory.com,Automation#monitoring
Hexowatch,Stay up-to-date on important changes to your website or your competitor's websites. Create a business around monitoring and watching your competitor's next move.,https://link.aitoolsdirectory.com/hexowatch,https://aitoolsdirectory.com,Automation
Landr,"Landr offers cloud-based AI mastering software that analyzes tracks using AI algorithms to make adjustments to the mix, including EQ, compression, and stereo widening. It also offers an API for partners to integrate AI-powered mastering into their apps and platforms.",https://link.aitoolsdirectory.com/landr,https://aitoolsdirectory.com,Music
Yaara,"Writing assistant for SEO-driven content, including website copy, headlines, product bullet points, meta descriptions, about us copy, and FAQs. Generate presentations and social media content without calling for a copywriter.",https://link.aitoolsdirectory.com/yarra,https://aitoolsdirectory.com,Copywriting
Referral Factory,"Referral Factory is an AI-powered tool that offers you a quick setup of custom or pre-built affiliate marketing programs. It integrates with major CRMs, provides easy referral tracking, and automates rewarding successful referrals.",https://link.aitoolsdirectory.com/referral-factory,https://aitoolsdirectory.com,Marketing#referrals #growth
Winston ai,Discover if it's a person or an AI that wrote your content with Winston AI. Detect plagiarism and make sure copy is written by humans,https://link.aitoolsdirectory.com/winston,https://aitoolsdirectory.com,AI Detection
AI Lawyer,"A multilingual, affordable legal assistant providing instant help, document drafting, and contract review.",https://link.aitoolsdirectory.com/ailawyer,https://aitoolsdirectory.com,Productivity#legal #assistant
Netus AI,"Fine-tune paraphrasing with your own voice while bypassing plagiarism & AI detection. Integrate cutting-edge technology for efficient, high-quality content generation. Upcoming features: plagiarism checker & multilingual support.",https://link.aitoolsdirectory.com/netus,https://aitoolsdirectory.com,Copywriting
Deblank,Create unique color palettes and font pairings with AI. See them come to life on real mockup examples that suit your prompt.,https://link.aitoolsdirectory.com/envato,https://aitoolsdirectory.com,Design Generators
Skybox Lab,Skybox Lab is an AI-powered tool that allows you to generate stunning 360° skybox experiences just by entering text prompts. It's perfect for those looking to quickly create immersive virtual spaces,https://www.blockadelabs.com/?via=aitoolsdirectory-com,https://aitoolsdirectory.com,Generative Art#virtual worlds
Ghost Writer,Hire dead authors to write in a variety of styles - generate stories or content from scratch or rephrase your work quickly and make it remarkable.,https://link.aitoolsdirectory.com/ghostwriter,https://aitoolsdirectory.com,Copywriting
InsightBaseAI,"Chat effortlessly with your data using InsightBase, an AI tool that turns complex analytics into casual conversations. Uncover valuable insights",https://insightbase.ai/?via=aitoolsdirectory-com,https://aitoolsdirectory.com,Business Intelligence
Bannerbear,BannerBear offers an automated solution for generating social media visuals with no coding required. The Open AI Whisper integration lets you autotranscribe voice and create videos with the text instantly.,https://link.aitoolsdirectory.com/bannerbear,https://aitoolsdirectory.com,Social Media
SEO GPT,"The AI-driven marketing & SEO tool you've been looking for. With 200+ methods for crafting titles/descriptions, backed by 16 years of marketing expertise, delivering undetectable human-like content that's authentic, credible, and saves time & effort.",https://link.aitoolsdirectory.com/seovendor,https://aitoolsdirectory.com,SEO#Content Generator #Writing
Picsart,"Picsart delivers AI-powered editing, filters, and images for pro-quality graphics; with video editing, image enhancement, and AI avatars. Available in 30 languages.",https://link.aitoolsdirectory.com/picsart,https://aitoolsdirectory.com,Generative Art#image #art
Audo,"Audo Studio rapidly enhances audio by eliminating background noise, reducing echoes, and adjusting volume, providing great results for a wide range of users.",https://audo.ai/?via=aitoolsdirectory-com,https://aitoolsdirectory.com,Audio#YouTube #podcasting
NeuralNewsletters,"Create personalized, up-to-date newsletters tailored to your audience's interests, all within minutes and without writing a word - saving you time, money and enhancing subscriber engagement.",https://link.aitoolsdirectory.com/neuralnewsletters,https://aitoolsdirectory.com,Marketing#newsletters
Marketing Megaprompts,"A bespoke set of unique prompts from MakerBox designed to fuel innovative marketing strategies, meticulously curated for solopreneurs and indie hackers seeking top-tier quality and personalized solutions.",https://link.aitoolsdirectory.com/makerbox-megaprompts,https://aitoolsdirectory.com,Marketing#ChatGPT #prompts
Mixo,"With just a brief description of your idea, Mixo will generate your entire website content in seconds. Great for pre-launching products, gathering insights, building waiting lists, running beta testing programs or just validating new product ideas.",https://link.aitoolsdirectory.com/mixo,https://aitoolsdirectory.com,Copywriting
Elephas,"Elephas is an AI assistant that helps you write faster and better across Mac, iPhone, and iPad. It offers different writing modes, including professional, friendly, viral, and persuasive, and features like generating Excel formulas, presentations, and viral headlines.",https://link.aitoolsdirectory.com/elephas,https://aitoolsdirectory.com,Copywriting#writing #MacOS
Github Autopilot,"Autopilot takes a lot of grunt work and hassle out of coding by suggesting snippets of code to developers - learning from its experiences and adapting to new coding styles as it goes along. With Autopilot, coders can write code faster and more accurately",https://github.com/features/copilot?via=aitoolsdirectory-com,https://aitoolsdirectory.com,Coding#coding assistant #dev
Luma AI,"Luma AI, created by Luma Labs, is an app and service that uses neural rendering technology to capture 3D images with only a few photos",https://lumalabs.ai/?via=aitoolsdirectory-com,https://aitoolsdirectory.com,Generative Art
Playground AI,"Generate artwork, social media posts, presentations, posters, videos, logos and more with intuitive design tools and a simple user interface",https://playgroundai.com?via=aitoolsdirectory-com,https://aitoolsdirectory.com,Generative Art#image #design
Caspar AI,"Caspar's Chrome extension helps you generate summaries, simplify complex topics, and make work more manageable. The Open AI processing provides article summaries instantly, streamlining professional workflows for personal and work use.",https://chrome.google.com/webstore/detail/casper-ai/fgfiokgecpkambjildjleljjcihnocel,https://aitoolsdirectory.com,Copywriting#summarizer
GetGenie,"Genie is an AI-powered WordPress plugin that allows users to perform multiple tasks such as keyword analysis, SERP competitor analysis, blog post and sales copy writing, title variation generation, meta description creation, introductory paragraphs creation and social media copy writing. Genie also offers product description and paragraph rewriter features.",https://link.aitoolsdirectory.com/getgenie,https://aitoolsdirectory.com,Copywriting#WordPress #SEO
