name,description,url,source,category
Akool AI,"AKOOL is an AI content suite for creating avatar videos, translations, face swaps, and photo animations, designed for marketing, education, and enterprise teams needing scalable creative media.",https://akool.com/,https://aitoolsdirectory.com,Generative Video
Pictory,"A versatile video creation and editing tool that transforms articles, scripts, visuals, and voice into captivating, shareable social media content, while offering customization and high-quality output.",https://link.aitoolsdirectory.com/pictory,https://aitoolsdirectory.com,Generative Video
1of10,"1of10 is a YouTube AI tool that helps creators generate and edit thumbnails optimized for performance. It uses AI to suggest viral thumbnail formats and maintain brand consistency, saving time and effort.",https://link.aitoolsdirectory.com/1of10,https://aitoolsdirectory.com,Marketing
HeyGen,"Transform your business videos with HeyGen, an AI video generation platform that creates professional, multilingual content in less time than it takes to email a freelancer. Check out the new URL to UGC tool. Transform any product listing into viral social content.",https://heygen.com/?sid=rewardful&via=aitools,https://aitoolsdirectory.com,Text-to-Video
Klap,"Klap transforms your YouTube content into digestible short videos for TikToks, Reels, and more using AI. With a unique focus on curation, framing, captions, and style, it ensures rapid, ready-to-publish video generation.",https://link.aitoolsdirectory.com/klap,https://aitoolsdirectory.com,Video Editing#TikTok #YouTube
Taskade,"Multiple tools in one. A productivity powerhouse that unifies task management and workflow creation into a sleek tool, offering dynamic workspace formats, intelligent note-taking, and a diligent AI assistant for your professional life.",https://link.aitoolsdirectory.com/taskade,https://aitoolsdirectory.com,Productivity#task manager
Merlin,"Merlin AI is an AI Assistant app and Chrome extension that brings AI-powered assistance to your browser, helping you create social media content, summarize videos and blogs, chat with websites, debug code, write emails, and respond to Google queries.",https://link.aitoolsdirectory.com/merlin,https://aitoolsdirectory.com,Chat#chatGPT #chatbot
Browse AI,"Browse AI simplifies data extraction from websites. No coding required, it allows you to scrape data, monitor changes, integrate with other apps, schedule extraction, create APIs, and automate complex processes.",https://link.aitoolsdirectory.com/browseai,https://aitoolsdirectory.com,Automation
Le Chat,"Le Chat by Mistral AI is a high-speed, privacy-focused AI assistant designed to compete with major AI chatbots. It offers cost-efficient API pricing, multilingual support, and strong natural language processing capabilities.",https://chat.mistral.ai/,https://aitoolsdirectory.com,Chat
SlidesAI,"SlidesAI converts your text or topic into structured Google Slides presentations in minutes. Customize tone, layout, and visuals without touching a template or design tool.",https://link.aitoolsdirectory.com/slidesai,https://aitoolsdirectory.com,Productivity
Dropmagic,"Build Shopify stores from AliExpress or product URLs. Generate high-converting pages, brand assets, and multilingual copy in minutes with 1-click Shopify export.",https://link.aitoolsdirectory.com/dropmagic,https://aitoolsdirectory.com,Marketing
Galaxy AI,"Your go-to hub for AI tools. This all-in-one AI platform offers over 1,500 tools for a fraction of the cost of individual subscriptions.",https://link.aitoolsdirectory.com/galaxy,https://aitoolsdirectory.com,Productivity
LearnWorlds AI,"Discover the transformative impact of LearnWorlds' new AI features in refining your course creation process. These tools guide in course layout, stimulate fresh content ideas, amplify learner involvement, and enable a custom learning experience.",https://link.aitoolsdirectory.com/learnworlds-ai,https://aitoolsdirectory.com,Education
10Web,"10Web builds WordPress websites from a short text prompt. It generates full layouts, copy, and images using AI. Ideal for small businesses and freelancers needing fast deployment.",https://link.aitoolsdirectory.com/10web,https://aitoolsdirectory.com,Marketing
AdCreative.ai,"An ad creation platform that uses artificial intelligence to make high-quality, conversion-focused ad creatives and social media post creatives in a matter of seconds.",https://link.aitoolsdirectory.com/adcreative,https://aitoolsdirectory.com,Advertising
Blaze,"Blaze AI combines content generation and marketing automation tools to help small businesses manage their digital presence. The platform handles content creation, social media scheduling, and brand consistency across channels.",https://link.aitoolsdirectory.com/blaze,https://aitoolsdirectory.com,Marketing
OpusClip,"Transform your videos into engaging shorts with OpusClip's AI-powered tools. Its unique technology identifies key segments, provides viral potential scores, allows keyword-based clipping, and enhances content with emojis and keywords.",https://link.aitoolsdirectory.com/opusclip,https://aitoolsdirectory.com,Social Media
Quickads,"AI ad creation is made easy with Quickads AI. Suitable for all businesses. Features include multi-format ads, targeted generation, virtual product photography, customizable layouts, messaging variations, and automated error detection.",https://link.aitoolsdirectory.com/quickads,https://aitoolsdirectory.com,Advertising
i10x,"i10X gives you access to 30+ AI models and 500+ prebuilt task agents through a single platform. Ideal for small teams, creators, and AI-heavy workflows.",https://link.aitoolsdirectory.com/i10x,https://aitoolsdirectory.com,Productivity
Talkio,"Speak Like a Native with AI Conversation Practice. Talkio AI is a language learning tool that provides instant practice in different languages, dialects and with AI tutors.",https://link.aitoolsdirectory.com/talkio,https://aitoolsdirectory.com,Education
Trupeer,"Create polished product walkthrough videos and step-by-step user guides using Trupeer’s AI tools. Record once, and generate content in multiple formats and languages within minutes.",https://link.aitoolsdirectory.com/trupeer,https://aitoolsdirectory.com,Productivity
Fireflies,"Supercharge meetings with AI notetaking, auto-transcription, platform integration, collaboration tools, real-time knowledge base, performance analytics, and voice-activated workflow automation. Record and transcribe meeting conversations to boost productivity",https://link.aitoolsdirectory.com/fireflies,https://aitoolsdirectory.com,Productivity#productivity
BASE44,"Build fully functional apps in minutes by describing them in plain English. BASE44 handles the database, UI, auth, and deployment—no code, no setup, no integrations needed.",https://link.aitoolsdirectory.com/base44,https://aitoolsdirectory.com,NoCode
TalkPal,"Immerse yourself in lifelike conversations, receive real-time feedback, and enjoy dynamic active listening exercises, powered by an AI language tutor",https://link.aitoolsdirectory.com/talkpal,https://aitoolsdirectory.com,Education
Uplup,"Uplup is an AI-powered form, poll, and contest tool that turns your one-line brief into a targeted, custom content on 60+ social platforms. You get viral giveaway tools, extensive integrations, and a reward system to promote authentic participation and viral growth.",https://link.aitoolsdirectory.com/uplup,https://aitoolsdirectory.com,Marketing
Replit,A browser-based coding platform with deep AI assistance to help non-technical users build and deploy web applications through natural language prompts and automated development tools.,https://link.aitoolsdirectory.com/replit,https://aitoolsdirectory.com,Coding
Aragon,"Aragon's AI Headshot Generator transforms your selfies into stunning and personalized headshots in just 90 minutes. Stand out with premium-quality photos, all without the need for a professional photoshoot.",https://link.aitoolsdirectory.com/aragon,https://aitoolsdirectory.com,Social Media#avatar #headshots
Adobe Express,"Adobe Express is a free, browser-based AI tool powered by Adobe Firefly, offering one-click actions and generative AI for quick and innovative designs for social media videos, PDFs, and marketing materials.",https://link.aitoolsdirectory.com/adobe-express,https://aitoolsdirectory.com,Graphic Design
Vista Social,"Vista Social, a social media management tool, offers an AI Assistant feature that helps you generate engaging social media posts, paraphrase high-performing posts, and add fact-checked stats. You can also automate responses to comments and mentions with AI-powered content.",https://link.aitoolsdirectory.com/vistasocial,https://aitoolsdirectory.com,Social Media#writing assistant
n8n,"n8n is an open-source workflow automation tool that allows you to connect various apps and services together. Its visual, node-based interface makes it easy to build powerful automations with AI integrations from OpenAI and Hugging Face, making it ideal for automating tasks, improving workflows, and building intelligent applications.",https://link.aitoolsdirectory.com/n8n,https://aitoolsdirectory.com,Automation
Bubble AI,"Create custom web pages and apps in minutes with Bubble’s AI-powered design and development tools, making sophisticated web development accessible to everyone.",https://link.aitoolsdirectory.com/bubble-ai,https://aitoolsdirectory.com,NoCode
Clickup,"ClickUp AI is an intelligent assistant that simplifies complex work processes by streamlining each step of the task, writing content and task details, and adding structure to your documents.",https://link.aitoolsdirectory.com/clickup,https://aitoolsdirectory.com,Productivity
Alphana,"Transform your videos, podcasts, and ideas into shareable content with Alphana. Create summaries, articles, and social media posts effortlessly. Utilize automated transcription, personalized output, and multichannel marketing features.",https://link.aitoolsdirectory.com/alphana,https://aitoolsdirectory.com,Marketing
User Evaluation,Enhance consumer research efficiency and depth with this versatile tool for market researchers and customer-focused teams.,https://link.aitoolsdirectory.com/userevaluation,https://aitoolsdirectory.com,Marketing#UX #Research
VideoGen,"Generate professional videos from text, images, and articles for TikTok, Instagram Reels, and YouTube. With AI assistance, 3M+ assets, multilingual text-to-speech, and an intuitive editor, VideoGen is a great tool for marketers, creators, and businesses.",https://link.aitoolsdirectory.com/videogen,https://aitoolsdirectory.com,Video Generation
HypeAuditor,"AI-powered influencer marketing platform providing comprehensive analytics, discovery, and campaign management across major social platforms with almost 200M+ creator database.",https://link.aitoolsdirectory.com/hypeauditor,https://aitoolsdirectory.com,Marketing
Marky,"Marky is your AI-powered social media assistant—creating, designing, and scheduling tailored posts across platforms so your business stays active with less effort.",https://link.aitoolsdirectory.com/marky,https://aitoolsdirectory.com,Social Media
JobWinner,"JobWinner uses AI to generate tailored resumes, cover letters, and interview prep in minutes — not hours. Perfect for active job seekers, freelancers, and anyone tired of repetitive applications.",https://link.aitoolsdirectory.com/jobwinner,https://aitoolsdirectory.com,Productivity
RenderLion,"RenderLion turns your content into polished video clips. Add text, images, or links and get trendworthy and attention-grabbing AI clips formatted for any platform.",https://link.aitoolsdirectory.com/renderlion,https://aitoolsdirectory.com,Video Generation
StealthGPT,"Generate undetectable, unique AI-written content with tools for rephrasing, essays, and more, ensuring originality and avoiding AI detection.",https://link.aitoolsdirectory.com/stealthgpt,https://aitoolsdirectory.com,AI Detection
SocialBee,"SocialBee's AI-powered post generator creates social media posts based on your preferred topics and keywords, saving you time and effort, and helps to keep a consistent and impactful social media presence.",https://link.aitoolsdirectory.com/socialbee,https://aitoolsdirectory.com,Social Media
ElevenLabs,"ElevenLabs offers an AI audio platform with emotionally aware text-to-speech, voice cloning, and dubbing capabilities in 32 languages, suitable for content creators, businesses, and developers.",https://link.aitoolsdirectory.com/eleven-labs,https://aitoolsdirectory.com,Text-to-Voice
Freebeat,"Generate short-form music videos from a text prompt and audio track. Freebeat creates synced, stylized content for creators, musicians, and educators.",https://link.aitoolsdirectory.com/freebeat,https://aitoolsdirectory.com,Video Generation
Walter Writes,Walter Writes AI edits AI-generated text to make it indistinguishable from human writing. It is built specifically to bypass AI detection tools. The output is consistently plagiarism-free.,https://link.aitoolsdirectory.com/waterwrites,https://aitoolsdirectory.com,AI Detection
Beehiiv,"AI tools for newsletter operators, including an AI writing assistant for content generation, text tools for seamless editing, image creation from descriptions, and multilingual translation.",https://link.aitoolsdirectory.com/beehiiv,https://aitoolsdirectory.com,Marketing#newsletters #email
Munch,"Munch extracts the most engaging, contextual nuggets from long-form content and presents them as catchy, shareable clips. It uses GPT3, OCR, and NLP to analyze the clip's content and match it with social and marketing trends.",https://link.aitoolsdirectory.com/munch,https://aitoolsdirectory.com,Video Editing#video #YouTube
Decktopus,"AI-driven, one-click presentation wizard that personalizes slides, streamlines layouts, and enriches content for standout results.",https://link.aitoolsdirectory.com/decktopus,https://aitoolsdirectory.com,Productivity
Hypernatural,"Convert ideas, scripts, and podcasts into customizable short-form videos. Create custom styles, AI narration, and optimize for effortless content creation.",https://link.aitoolsdirectory.com/hypernatural,https://aitoolsdirectory.com,Generative Video
Soundraw,"Create unlimited royalty-free songs by simply selecting a mood, genre and length. Browser-based music tool that creates royalty-free tracks on demand, built for content creators and musicians who need fast, editable music without licensing headaches.",https://link.aitoolsdirectory.com/soundraw,https://aitoolsdirectory.com,Music#AImusic #sounddesign
aiCarousels,"AICarousels transforms content into scroll-stopping carousel posts for Instagram, LinkedIn, and TikTok. Add your topic, or paste a URL or YouTube video, and AICarousels produces eye-catching visual stories with matching fonts and color schemes.",https://link.aitoolsdirectory.com/aicarousels,https://aitoolsdirectory.com,Copywriting
Eddie AI,"AI-powered desktop assistant editor that helps professionals turn longform video into structured edits. Built for use with Premiere, Final Cut, and Resolve.",https://link.aitoolsdirectory.com/eddie,https://aitoolsdirectory.com,Video Editing
Thoughtly,"Thoughtly builds human-like AI voice agents for seamless call handling, analytics, and lead qualification. Perfect for businesses needing automated yet human-centered customer interactions.",https://link.aitoolsdirectory.com/thoughtly,https://aitoolsdirectory.com,Automation#VoiceAI #AIAgents
Exolyt,"Dominate TikTok with data-driven analytics, growth marketing, and AI-powered content idea generation for businesses and creators.",https://link.aitoolsdirectory.com/exolyt,https://aitoolsdirectory.com,Social Media
Followr,"AI-Powered Social Media Management for Effortless Scheduling, Content Creation, and Analytics Across All Platforms",https://link.aitoolsdirectory.com/followr,https://aitoolsdirectory.com,Social Media
BeforeSunset AI,"Blend AI-powered scheduling with a customizable virtual workspace. Get time-blocking, task management, and productivity analytics in one platform which work-life balance with specialized AI features.",https://link.aitoolsdirectory.com/beforesunset,https://aitoolsdirectory.com,Productivity
TikTok,"TikTok Symphony and Creative Assistant are AI-driven tools that make TikTok ads easier by offering features like trend analysis, automatic content generation, and ad optimization. Ad ideation, video generation, and performance enhancement tools work great for advertisers of all sizes.",https://link.aitoolsdirectory.com/tiktok,https://aitoolsdirectory.com,Advertising
Letterly,"Letterly turns your voice into structured, rewritten text in seconds—tweets, emails, notes, and more. Fast, mobile-friendly, and built for people who think out loud.",https://link.aitoolsdirectory.com/letterly,https://aitoolsdirectory.com,Productivity
ContentShake,"An SEO-focused, reliable AI content writing assistant backed by Semrush. Get content ideas, optimize copy with AI, and publish directly to WordPress. Become an expert on any topic without reading all the books.",https://link.aitoolsdirectory.com/semrush-contentshake,https://aitoolsdirectory.com,Marketing
Divi AI,"Divi AI is an AI-powered page builder that offers tailored, contextually relevant content and image creation. It also offers smart suggestions based on your site's existing patterns, simplifying web design.",https://link.aitoolsdirectory.com/divi,https://aitoolsdirectory.com,Marketing
aiApply,"AIApply is an AI-powered job search tool that creates tailored resumes and cover letters, auto-applies to jobs, and provides interview practice to help you get hired faster.",https://link.aitoolsdirectory.com/aiapply,https://aitoolsdirectory.com,Automation
Prospero.ai,"Prospero.ai delivers stock picks based on institutional data, real-time signals, and market trends. Built for retail investors who want data-backed ideas without the noise or guesswork.",https://www.prospero.ai/?utm_source=aitoolsdirectory.com&utm_medium=referral,https://aitoolsdirectory.com,Investing
Lovable,"Lovable.dev helps everyone, from newbies to experts, build websites super fast, just by typing what they want.",https://link.aitoolsdirectory.com/lovable,https://aitoolsdirectory.com,Nocode
WebWave,"Create unique, responsive websites with AI-driven drag-and-drop design control. Enjoy creative freedom, SEO optimization tools, and AI copy generation. A robust platform for creating your ideal website or web project",https://link.aitoolsdirectory.com/webwave,https://aitoolsdirectory.com,Marketing
Hexomatic,"Use AI to scrape content from any website, find local busıness prospects in a few clicks using Google Maps, monitor Amazon for updates on specific products, or bulk create screenshots in any screen size to use in your marketing materials or software.",https://link.aitoolsdirectory.com/hexomatic,https://aitoolsdirectory.com,Automation#web scraping
Speechify,"text-to-speech platform offering natural AI voices, voice cloning, and video dubbing across 60+ languages. Popular with content creators, students, and professionals needing audio conversion tools.",https://link.aitoolsdirectory.com/speechify,https://aitoolsdirectory.com,Text-to-Voice
Weavely,"AI-powered form builder that turns prompts, voice notes, or files into styled, logic-based forms. Designed for fast launches, smart feedback, and data-driven workflows.",https://www.weavely.ai/?via=aitoolsdirectory-com,https://aitoolsdirectory.com,Marketing
Reelio,"Reelio uses AI to create short, faceless videos for social media. Define a topic, style, and voice; the AI generates scripts, visuals, and voiceovers.",https://link.aitoolsdirectory.com/reelio,https://aitoolsdirectory.com,Video Generation
Logo AI,"LogoAi is an AI powered logo maker and brand automation platform that can help small businesses create professional logos, design matching identities, and automate brand promotion with on-brand social media content.",https://link.aitoolsdirectory.com/logoai,https://aitoolsdirectory.com,Graphic Design
Murf,"Voice generator for professional-quality audio. Use Murf's lifelike AI voices for podcasts, videos, and all your professional presentations.",https://link.aitoolsdirectory.com/murf,https://aitoolsdirectory.com,Text-to-Voice#voice
Sysarchitect,"Build functional web apps by describing them in plain English. Sysarchitect generates source code, interactive mockups, and deployable projects—no coding, no dragging, just decisions.",https://www.sysarchitect.ai/,https://aitoolsdirectory.com,NoCode
Phrasly,"Phrasly helps you generate and humanize AI content to bypass AI detectors like TurnItIn and GPTZero, ensuring originality and efficiency.",https://link.aitoolsdirectory.com/phrasly,https://aitoolsdirectory.com,Copywriting
HIX Bypass,"HIX Bypass: AI content detector & remover. Converts AI-generated text into undetectable, human-like content. Preserves original meaning and bypasses AI detectors. Your AI assistant for writing with ChatGPT.",https://link.aitoolsdirectory.com/hixai,https://aitoolsdirectory.com,Productivity
ContentStudio AI,"ContentStudio’s AI Writer simplifies social media content creation with its automated scheduling, discovery and creation tools. It generates engaging captions for images; corrects grammar; adds emojis to hashtags; creates brand-aligned images from scratch & enhances existing content",https://link.aitoolsdirectory.com/contentstudio,https://aitoolsdirectory.com,Social Media
RepublicLabs,A unified platform for AI image and video generation that lets you test multiple models simultaneously. Includes practical tools for business headshots and product photography.,https://link.aitoolsdirectory.com/republiclabs,https://aitoolsdirectory.com,Generative Video
Vidnoz,"An AI video creation tool offering text-to-video conversion with lifelike avatars and 100+ voiceovers. With 200+ templates and 23+ languages supported, Vidnoz facilitates quick, affordable, and quality video content production.",https://link.aitoolsdirectory.com/vidnoz,https://aitoolsdirectory.com,Generative Video
Watermelon,"Watermelon builds chatbots that answer customer questions across messaging platforms and websites, using your content as the knowledge base.",https://link.aitoolsdirectory.com/watermelon,https://aitoolsdirectory.com,Chat
Monica,"A browser-based AI assistant that combines multiple AI models to help professionals with writing, research, and analysis tasks. Works directly in your browser with a clean, minimal interface.",https://link.aitoolsdirectory.com/monica,https://aitoolsdirectory.com,Productivity
text.ai,"AI assistant that works inside SMS, WhatsApp, and Telegram chats to help plan events, answer questions, and make group chats more useful—no app download required.",https://www.text.ai,https://aitoolsdirectory.com,Chat
InLinks,"An SEO tool that provides Entity-based Page & Site Optimization, Automated Internal Linking, Broader & Deeper Keyword Research, and Comprehensive Content Briefs. InLinks AI writing assistant helps you write cotnent, prioritize drafts, interlink current topics, and audit the current content and suggest improvements.",https://link.aitoolsdirectory.com/inlinks,https://aitoolsdirectory.com,SEO
AnimeGenius,"AI anime art generator that converts plain text or photo into anime art with simplicity, speed, and high artistry. Ideal for anime enthusiasts and those without drawing or AI expertise.",https://link.aitoolsdirectory.com/animegenius,https://aitoolsdirectory.com,Generative Art
Tripo AI,"Create 3D models from text or images in seconds. Tripo AI offers fast prototyping, stylization options, and dev-friendly APIs",https://www.tripo3d.ai/?utm_source=aitoolsdirectory,https://aitoolsdirectory.com,Generative Video
PPSPY,"PPSPY helps Shopify store owners find profitable products and analyze competitors using AI-powered analytics. Track sales data, research winning products, and study successful store designs.",https://link.aitoolsdirectory.com/ppspy,https://aitoolsdirectory.com,Business Intelligence
Vidalgo,"Create viral TikTok content by automating video production, enhancing engagement and visibility with AI-optimized titles and hashtags. Enjoy extensive customization options and supporting unlimited content testing for better audience resonance.",https://link.aitoolsdirectory.com/vidalgo,https://aitoolsdirectory.com,Text-to-Video
ChatPlayground,"ChatPlayground AI has over 25 AI models in one place, browser integration and customizable tools to supercharge your productivity and simplify your AI workflow.",https://link.aitoolsdirectory.com/chatplayground,https://aitoolsdirectory.com,Productivity
Submagic,"Add life to your videos with accurate transcriptions in 48 languages, trendy templates, enhanced captions with emojis and keyword highlights—all at the touch of a button. It's like waving a magic wand for global content creation",https://link.aitoolsdirectory.com/submagic,https://aitoolsdirectory.com,Video Editing
KIVA,"KIVA is an AI SEO tool that automates keyword research, content briefs, and performance tracking using GSC data and LLM trends",https://wellows.com/kiva/?via=aitoolsdirectory-com,https://aitoolsdirectory.com,SEO
Cliptalk,"Cliptalk rapidly converts scripts into publish-ready videos, automating edits, captions, and B-roll, perfect for social media.",https://link.aitoolsdirectory.com/cliptalk,https://aitoolsdirectory.com,Video Generation
Snoooz,"Snoooz takes the hassle out of managing your inbox with smart, personalized replies, sentiment tracking, and automated email routing, making communication smoother for businesses and professionals.",https://link.aitoolsdirectory.com/snooozai,https://aitoolsdirectory.com,Automation
