name,description,url,source,category
Paragraph AI,"A powerful AI-powered writing tool for producing high-quality content, ParagraphAI offers you all the assistance you need and helps you write better content by making suggestions, editing and proofreading your work.",https://link.aitoolsdirectory.com/paragraph,https://aitoolsdirectory.com,Copywriting#writing #assistant
GPT zero,"Accurate, easy to integrate, and attuned to sniffing out AI-written content, be it in sentences, paragraphs, or whole documents. Trained on a vast corpus of human and AI-generated text, it works effectively across major AI models, acting as your personal truffle pig in the vast forests of online content.",https://link.aitoolsdirectory.com/gptzero,https://aitoolsdirectory.com,AI Detection
ProPhotos,"Upgrade your professional image with ProPhotos, an AI-powered headshot generator. Easily transform casual photos into polished headshots. Perfect for LinkedIn, resumes, and more.",https://link.aitoolsdirectory.com/prophotos,https://aitoolsdirectory.com,Image Editing
Profile Picture AI,Profile Picture AI produces customized and visually appealing images for online identity based on inputs such as uploaded photographs and user preferences. This tool will help you look amazing on the internet,https://link.aitoolsdirectory.com/profilepicture,https://aitoolsdirectory.com,Social Media#avatar #image
REimagineHome,"REimagineHome is an AI platform offering virtual staging, remodeling, and landscaping services for professionals in real estate, marketing, photography, and design, with a free trial available.",https://link.aitoolsdirectory.com/reimaginehome,https://aitoolsdirectory.com,Design Generators
Filmora,"Create standout videos with Filmora's ChatGPT integration and vast resources for the ultimate video-making experience. Filmora's advanced AI, speech-to-text, and subtitle generator functions provide a professional touch, making it an all-in-one solution for all your video-making needs.",https://link.aitoolsdirectory.com/filmora,https://aitoolsdirectory.com,Video Generation
Brand24,Use Brand24 to monitor your brand online and make sure you’re always in control of your online reputation with the help of AI-driven analytics.,https://link.aitoolsdirectory.com/brand24,https://aitoolsdirectory.com,Social Media
Puppetry,"Puppetry simplifies talking head video creation with lifelike avatars and text-to-speech capabilities powered by ChatGPT. It’s ideal for educators, marketers, and content creators who need professional, engaging videos quickly and efficiently. No fuss, just effective results.",https://link.aitoolsdirectory.com/puppetry,https://aitoolsdirectory.com,Video Generation
DimeADozen,"DimeADozen AI provides instant business idea validation, leveraging GPT-4 for data analysis, offering market-specific reports and maintaining idea confidentiality. Trusted by over 75,000 businesses for better decision-making.",https://link.aitoolsdirectory.com/dimeadozen,https://aitoolsdirectory.com,Business Intelligence
Secta Labs,Secta Labs advanced AI image tool converts selfies into professional headshots within hours with a selection of styles available in a private gallery.,https://link.aitoolsdirectory.com/secta,https://aitoolsdirectory.com,Image Editing
CoachVox,"Create an AI version of yourself. Coachvox AI offers personalized, lead-generating chatbots, that mimick your style and workflow. Ideal for entrepreneurs, content creators, teachers, mentors, and coaches",https://link.aitoolsdirectory.com/coachvox,https://aitoolsdirectory.com,Marketing
Moonbeam,"Whether you're writing an essay, a story, an article, a blog, or other lengthy material, Moonbeam provides you with insights (and content) to produce the best content on the topic.",https://link.aitoolsdirectory.com/moonbeam,https://aitoolsdirectory.com,Copywriting
Katteb,"Katteb AI writer verifies information in advance of writing and is capable of covering current affairs. And with the chat feature, you can write content based on real-time data from the internet or YouTube videos. Use saved snippets or uploads to write about specific topics or content based on URLs.",https://link.aitoolsdirectory.com/katteb,https://aitoolsdirectory.com,Copywriting#writing #assistant
PDF ai,"Chat with any document and PDF using AI. From legal agreements to financial reports, PDF.ai brings your documents to life. You can ask questions, get summaries, find information, and more.",https://link.aitoolsdirectory.com/pdfai,https://aitoolsdirectory.com,Productivity
SEOPress,"SEOPress PRO is a WordPress SEO plugin that integrates with OpenAI to generate automated metadata. Get help creating titles and meta descriptions with AI-driven insights, and save time and money with the bulk actions feature",https://link.aitoolsdirectory.com/seopress,https://aitoolsdirectory.com,SEO#SEO #WordPress
Upmetrics,"Upmetrics is an AI-powered business planning platform that helps entrepreneurs and small business owners create winning business plans, financial forecasts, and investor-ready pitch decks with collaborative features, data-driven insights, and step-by-step guidance.",https://link.aitoolsdirectory.com/upmetrics,https://aitoolsdirectory.com,Business Intelligence
ProductScope,ProductScope AI takes your e-commerce visuals from standard to standout while optimizing your Amazon listings for maximum engagement and sales.,https://link.aitoolsdirectory.com/productscope,https://aitoolsdirectory.com,Marketing
SiteSpeakAI,"SiteSpeakAI is a chatbot powered by ChatGPT, offering personalized real-time 24/7 support for your website visitors. It improves customer interaction while optimizing conversions with easy integration and insightful analytics.",https://link.aitoolsdirectory.com/sitespeak,https://aitoolsdirectory.com,Chat
Koala AI,"Koala AI offers tools for creating SEO-optimized content using real-time data and SERP analysis. It generates ready-to-publish articles, integrates with platforms like WordPress, and includes features like automatic link insertion, Amazon affiliate content, and custom ChatGPTs for lead conversion.",https://link.aitoolsdirectory.com/koala,https://aitoolsdirectory.com,Copywriting
MosaChat-AI,"MosaChat-AI is an intelligent tutor that allows you to practice languages in real time, giving you feedback on your mistakes and helping you improve your language skills faster.",https://link.aitoolsdirectory.com/mosachat-ai,https://aitoolsdirectory.com,Education#language learning
LogicLister,"An e-commerce operations toolkit that helps automate product listings and content creation. Integrates SEO optimization, social media, and blog posts, with tools for speech-to-text and grammar correction.",https://link.aitoolsdirectory.com/logiclister,https://aitoolsdirectory.com,Copywriting
KeywordsPeopleUse,"KeywordsPeopleUse harnesses AI and neural networks for advanced keyword research, content ideation, and SEO planning. By generating contextual keywords, providing AI assistance, and automating topic clustering, it simplifies content strategy and offers instant, data-backed insights.",https://link.aitoolsdirectory.com/keywordspeopleuse,https://aitoolsdirectory.com,SEO
PDF Flex,PDF Summarizer - Engage With Your PDFs in Multiple Languages,https://pdfflex.com/ai-chat-with-pdf,https://aitoolsdirectory.com,Productivity
Manatal,"Recruitment software solution Manatal.com provides organizations with a variety of AI-based tools to facilitate candidate sourcing, tracking, and hiring.",https://link.aitoolsdirectory.com/manatal,https://aitoolsdirectory.com,Recruitment
One Click Human,"OneClickHuman transforms AI-generated text into natural, human-like content, optimized for SEO and free from errors, all with a single click.Use the code AITOOLS to get 60% off the paid version",https://oneclickhuman.com/?via=aitoolsdirectory-com,https://aitoolsdirectory.com,SEO
Coursebox AI,"Efficient, rapid online course creation. Transform your content into interactive modules. Enjoy distribution flexibility and a customizable platform to suit your unique requirements.",https://link.aitoolsdirectory.com/coursebox,https://aitoolsdirectory.com,Education#edtech #courses #LMS
QR Galaxy,"QR Galaxy elevates QR codes by integrating them with AI-generated images, offering a unique blend of functionality and aesthetics for businesses and individuals.",https://www.qr-galaxy.com/?utm_source=directory&utm_medium=banner&utm_campaign=aitools,https://aitoolsdirectory.com,Design Generators
Hexofy,"Hexofy is a one-click browser extension for web scraping. It extracts data from popular sites, integrates with Google Sheets, and features an AI assistant for summarization, social posts, and free-form AI prompting.",https://link.aitoolsdirectory.com/hexofy,https://aitoolsdirectory.com,Automation
GPTinf,"GPTinf skillfully rehashes AI-generated text, bypassing AI detection through enhanced vocabulary diversity and perplexity metrics.",https://link.aitoolsdirectory.com/gptinf,https://aitoolsdirectory.com,AI Detection
Surfer SEO,"SERP-winning content writing with a click. From researching to optimizing articles—it's about driving traffic. Customize, refine, and improve your work with AI. Write and optimize your content in any language, leveraging real-time metrics for structure, word count, NLP-ready keywords, and images.",https://link.aitoolsdirectory.com/surferseo,https://aitoolsdirectory.com,SEO#SEO #writing
Keyword Insights,"Keyword Insights is a keyword research tool with professional-level AI writing features. Refine your content creation and SEO with research, writing, and optimization tools you won't find anywhere else.",https://link.aitoolsdirectory.com/keywordinsights,https://aitoolsdirectory.com,Marketing
Frame,"Frame is an online platform where all your work tasks, wikis, whiteboards, goals, notes, and focus come together. Its features include smarter notes, organized task tracking, unified knowledge sharing, simple goal setting, and collaborative digital whiteboards.",https://frame.so/?via=aitoolsdirectory-com,https://aitoolsdirectory.com,Productivity
Gling,"Polish your videos by letting AI find and trim redundant sections from raw footage. With support for major editing software and an added layer of manual review, Gling is a great tool for video creative flow and ideal for creators seeking efficiency.",https://link.aitoolsdirectory.com/gling,https://aitoolsdirectory.com,Video Editing
Bodt,"Introducing Bodt, an AI-powered chatbot that enhances customer service, engagement, and visibility on your website. From automated support and personalized recommendations to secure log-ins and data analytics, Bodt has you covered.",https://link.aitoolsdirectory.com/bodt,https://aitoolsdirectory.com,Productivity
Trinka AI,Trinka is an online grammar checker and language correction AI tool for academic and technical writing. Trinka finds difficult errors unique to academic writing that other grammar checker tools don’t. From advanced English grammar errors to scientific tone and style.,https://link.aitoolsdirectory.com/trinka,https://aitoolsdirectory.com,Productivity
Audio writer,"Introducing Audio Writer: a speech-to-text software that saves time in content creation. Refine transcripts, rewrite in different styles, choose presets, support for 15+ languages, and repurpose content in various formats.",https://audiowriter.app?via=aitoolsdirectory-com,https://aitoolsdirectory.com,Productivity
Softr AI,"Softr AI simplifies app building, offering automatic data syncing with Google Sheets and an easy process to set up, edit, define user roles, and publish a functional web app.",https://link.aitoolsdirectory.com/softr-ai-app,https://aitoolsdirectory.com,NoCode
AimReply,"AI-powered email assistant enhancing productivity in sales, customer service, job hunting, content creation, and business management.",https://aimreply.com/?via=aitoolsdirectory-com,https://aitoolsdirectory.com,Marketing
PDF ai,Have conversations with PDFs. Get instant responses that include sourced information. Supports many types of PDF documents and offers multilingual functionality.,https://link.aitoolsdirectory.com/pdfai,https://aitoolsdirectory.com,Productivity
RankIQ,"A comprehensive SEO Toolset with AI baked in. RankIQ is the highest-rated SEO tool in the world that helps you craft perfectly optimized posts, boost traffic, and win Google's love.",https://link.aitoolsdirectory.com/rankiq,https://aitoolsdirectory.com,SEO#SEO
Nara,"Nara transforms customer support with AI. Instant responses, automated conversations, multi-channel support, and a user-friendly dashboard streamline engagement and boost satisfaction for your customers.",https://link.aitoolsdirectory.com/nara,https://aitoolsdirectory.com,Chat#CRM #Customer Support
Bertha AI,WordPress and Chrome AI Co-Pilot. Automate the process of generating content and integrate directly with WordPress or any other content management system.,https://link.aitoolsdirectory.com/bertha,https://aitoolsdirectory.com,Copywriting#writing #assistant
Eloise AI,"Eloise.Ai elevates your writing with top-quality content creation. Simplify tasks like word count and formatting tweaks, effortlessly refine sentences for engaging content, condense complex information, generate ideas, and craft concise, impactful written pieces.",https://link.aitoolsdirectory.com/eloise,https://aitoolsdirectory.com,Productivity
Media.io,"Introducing Media.io, the AI-powered suite for refining media files effortlessly. Massive free tools for simple creation, leading AI tech for pro-like results, rapid iteration, user-friendly interface for personal, promotional, and educational use.",https://www.media.io/?via=aitoolsdirectory-com,https://aitoolsdirectory.com,Productivity
AI Voice Detector,Authenticate audio and protect yourself from fake voices using AI Voice Detector. Ensure the legitimacy of any audio contents and avoid misinformation.,https://aivoicedetector.com/?via=aitoolsdirectory-com,https://aitoolsdirectory.com,AI Detection
InterviewSpark,"InterviewSpark's AI Interview Coach transforms practice sessions, providing instant feedback and measuring progress. Choose questions, record video, receive AI feedback, and track your improvement. Benefit as job seekers, students, or career changers.",https://interviewspark.io/?via=aitoolsdirectory-com,https://aitoolsdirectory.com,Education
iApply,"iApply, the world's first search engine connects job seekers worldwide. Organize and present your profile effectively. Explore endless job opportunities with AI scanning 4,000 real-time posted jobs.",https://link.aitoolsdirectory.com/iapply,https://aitoolsdirectory.com,Productivity
Aura AI,Introducing Aura AI: Unleash your creativity with an app that effortlessly transforms text prompts into stunning visual creations. Aura AI is the perfect tool for bringing your imagination to life with its adaptable modes and easy-to-use features.,https://auraai.app?via=aitoolsdirectory-com,https://aitoolsdirectory.com,Generative Art
Freeflo,"Reusable generative AI style prompts. Copy the prompt, swap the subject and drop it into Midjourney, Clipdrop, Firefly or DALL-E.",https://link.aitoolsdirectory.com/envato,https://aitoolsdirectory.com,Generative Art
SongR,"SongR: AI-based Song Generator. Craft personalized songs with keywords. Features: Easy to Use, Lyric Editing, Genre Customization, Input Your Own Lyrics, Device Compatibility. 5 songs per day limit.",https://app.songr.ai?via=aitoolsdirectory-com,https://aitoolsdirectory.com,Music
Wonderplan,"Wonderplan takes the hassle out of travel planning, offering personalized itineraries based on your interests, budget, and time constraints. It also helps you find the optimal route and takes care of all the boring details.",https://wonderplan.ai?via=aitoolsdirectory-com,https://aitoolsdirectory.com,Productivity
CustomGPT,"Build ChatGPT plugins without code. Expand your customer reach by integrating your company’s database on ChatGPT for instant, accurate response to customer queries or creating a search retrieval plugin—thus increasing your operational efficiency exponentially.",https://link.aitoolsdirectory.com/customgpt,https://aitoolsdirectory.com,Chat
ProfilePro,"Automate SEO with ProfilePro. Optimize your business description and more for local SEO, get SEO-optimized Google Business posts and product descriptions, personalized review responses, and simplify your Google Business profile optimization",https://merchynt.com/profilepro?via=aitoolsdirectory-com,https://aitoolsdirectory.com,Marketing
Validly,"Juno (previously called Validly) is an AI research assistant that improves user interviews. Effortlessly scale interviews, extract valuable insights, and ensure the security of your data. Unlock the potential of Validly for logical and insightful research.",https://heyjuno.co/?via=aitoolsdirectory-com,https://aitoolsdirectory.com,Chat#AI Assistant #AI Research
AI Voice Detector,Authenticate audio and protect yourself from fake voices using AI Voice Detector. Ensure the legitimacy of any audio contents and avoid misinformation.,https://aivoicedetector.com/?via=aitoolsdirectory-com,https://aitoolsdirectory.com,AI Detection
iSpring Page,"iSpring Page transforms traditional content into dynamic courses using AI-powered course creation workflows. Create professional, mobile-responsive course websites with customizable templates and a drag-and-drop editor.",https://www.ispringsolutions.com/ispring-page?ref=aitoolsdirectory_ispring-page&utm_source=aitoolsdirectory&utm_medium=referral&utm_campaign=ispring-page,https://aitoolsdirectory.com,Education
My GPT Wizard,"My GPT Wizard is your writing partner for all your content needs. Choose from a range of templates for blogs, articles, websites, and social media. The tool walks you through a detailed description of your request and delivers high-quality results ready to publish.",https://link.aitoolsdirectory.com/mygptwizard,https://aitoolsdirectory.com,Productivity
Writers brew,"Writers Brew: The ultimate writing assistant app that transforms rough notes to polished drafts. Features tools, preset settings, an AI-powered text editor, image-to-text conversion, email replies, translations, and personalized suggestions.",https://writersbrew.app,https://aitoolsdirectory.com,Copywriting
MindPal,"Build customized AI agents for tasks with your own data using MindPal. No coding required, web search integration, reliable sources, customizable instructions, contextual understanding, efficient chatbot assembly, and easy embedding options.",https://mindpal.space/?via=aitoolsdirectory-com,https://aitoolsdirectory.com,Chat#AI Agents #Chat Bots
Monic AI,"Generate quizzes, flashcards, and summaries in seconds using Monic AI. Chat with AI, effortlessly upload files and enjoy personalized learning features. It's great for students, professionals, and avid learners. AI generates intelligent assessments using advanced processing techniques.",https://monic.ai/?via=aitoolsdirectory-com,https://aitoolsdirectory.com,Education
Chivvy,"Chivvy, an AI-powered anti-procrastination habit tracker, offers personalized reminders, deadline embrace, TwitterControl™, relentless motivation, automatic progress update, and progress visualization to improve consistency in achieving your goals.",https://chivvy.app,https://aitoolsdirectory.com,Productivity
Magic Hour,"Designed for video creators, Magic Hour's user-friendly console is simple but powerful. With Video-to-Video, Animation, Face Swap, and Text-to-Video, your creativity and storytelling will have your audience asking for more.",https://magichour.ai?via=aitoolsdirectory-com,https://aitoolsdirectory.com,Video Editing
DescriptionWise,"DescriptionWise is an AI-powered tool designed for efficient and high-quality content creation in eCommerce and PIM, featuring bulk production capabilities, multi-language support, and easy integration with major platforms.",https://descriptionwise.ai/?via=aitoolsdirectory-com,https://aitoolsdirectory.com,Copywriting
Clockk,"Clockk uses AI to automatically track the time spent on different projects and clients, eliminating the need for start and stop timers. The tool also provides valuable insights for business growth and ensures privacy and control over data.",https://clockk.com/?via=aitoolsdirectory-com,https://aitoolsdirectory.com,Productivity
Vecteezy AI,"Vecteezy AI's Reverse Image Search eliminates laborious image searches by repurposing source images into conceptually-related, licensable pieces. This technology, refined by feedback from millions of professionals, excels in accuracy by prioritizing context over pixels, resulting in a streamlined, precise search experience.",https://link.aitoolsdirectory.com/vecteezy-ai-image,https://aitoolsdirectory.com,Generative Art
Zentask,"Zentask simplifies your workload with AI solutions. Features include faster content creation, customizable settings, SEO improvement, image generation, and creating custom instructions for tasks and challenges.",https://zentask.ai/?via=aitoolsdirectory-com,https://aitoolsdirectory.com,SEO
ClipBuddy,"Transform lengthy videos into must-watch moments with features like auto curation, dynamic captions, resizing, and seamless transitions.",https://clipbuddy.io?via=aitoolsdirectory-com,https://aitoolsdirectory.com,Video Editing
Shuffll,"Shuffll turns your video concept into a compelling story, using AI to provide an efficient script in no time. Shuffll harnesses the power of AI for superb visuals and animations—and engages audiences more powerfully than ever before!",https://link.aitoolsdirectory.com/shuffll,https://aitoolsdirectory.com,Generative Video
Elai,"Create AI-generated, personalized videos from text, with over 80 avatars and multilingual capabilities. One-click video translations in 75 languages allow you to reach a global audience.",https://link.aitoolsdirectory.com/elai,https://aitoolsdirectory.com,Text-to-Video
Elementor AI,"Elementor AI is the first to natively integrate AI into a website page builder. Generate original text, custom code, and captivating images inside your WordPress website. The tool offers context-specific suggestions, making branding consistent and automating measurements.",https://link.aitoolsdirectory.com/elementor-ai,https://aitoolsdirectory.com,Marketing
Photoshop Generative AI,"Adobe's Generative Fill, an AI-driven feature within Photoshop, can add missing elements in photos, extend landscapes, or eliminate unwanted elements. All is possible with text prompts and you can be sure of using the finished images for commercial use.",https://link.aitoolsdirectory.com/photoshop-generativeai,https://aitoolsdirectory.com,Graphic Design
SE Ranking,"SE Ranking's AI-powered assistant helps SEO experts, marketers, copywriters, and website owners create SEO-friendly content faster. The AI Writer can paraphrase competitors' content, while the Content Idea Finder and Content Editor provide in-depth keyword analysis and content optimization capabilities.",https://link.aitoolsdirectory.com/seranking,https://aitoolsdirectory.com,SEO
WindsorAI,"Windsor AI is the tool that connects all your marketing channels together. The marketing attribution technology delivers clear, comprehensive insights into ad spend value and ROI, and gives you full transparency on ad spend effectiveness.",https://link.aitoolsdirectory.com/windsor,https://aitoolsdirectory.com,Marketing
Bizway,"Turn your business ideas into actionable plans in minutes. Bizway saves information about your business idea, target market and product offerings, then lets you generate dynamically filled business planning docs with a couple of clicks.",https://www.bizway.io/?via=aitoolsdirectory-com,https://aitoolsdirectory.com,Business Intelligence
TubeBuddy,"TubeBuddy's Suggested Shorts tool is an AI sidekick that combs through your existing videos, cherry-picking the most engaging bits for you to repurpose into YouTube Shorts.",https://link.aitoolsdirectory.com/tubebuddy,https://aitoolsdirectory.com,Video Generation
Recast Studio,"Recast Studio transforms podcast content into short video clips, blog posts, social posts, SEO & social media content, and more. Get better content with your brand's aesthetics faster. Turn podcasts into viral highlights.",https://link.aitoolsdirectory.com/recaststudio,https://aitoolsdirectory.com,Podcasting
PodStash,"PodStash is an AI podcast that turns any web content into an audio version. It is narrated by professionals and available in multiple languages. It is also user-friendly, affordable, and constantly updated with new features.",http://podstash.ai/?via=aitoolsdirectory-com,https://aitoolsdirectory.com,Podcasting
Semrush outline builder,"By combining AI and SEO insights, Semrush's Outline Builder helps craft high-ranking content. With its ready-to-use suggestions, outlines, competitor analyses, and detailed briefs, it simplifies content creation.",https://link.aitoolsdirectory.com/semrush-outline,https://aitoolsdirectory.com,SEO
Describely,"Generate engaging product descriptions using AI, manage your catalogs effortlessly, collaborate with team members in-app, integrate with popular eCommerce platforms, customize your brand voice, optimize using SEO data, and create content in bulk.",https://link.aitoolsdirectory.com/describely,https://aitoolsdirectory.com,Copywriting
MicMonster,"Voice-over production AI tool with over 500 versatile voice styles, over 140 languages, and compatibility with any video software. A cloud-based service offering quality audio that you can use in video and audio content to engage and convert audiences.",https://link.aitoolsdirectory.com/micmonster,https://aitoolsdirectory.com,Text-to-Voice
