name,description,url,source,category
AutoShorts,Create unique faceless videos tailored for TikTok and YouTube with AutoShorts’ AI-powered platform. Customize scripts and manage multiple series from one centralized dashboard.,https://link.aitoolsdirectory.com/autoshorts,https://aitoolsdirectory.com,Text-to-Video
Adobe Firefly,"Adobe Firefly offers a versatile, creator-focused Generative AI for content creation and editing across various mediums. Generating custom vectors, brushes, and textures with just a few words or a sketch",https://link.aitoolsdirectory.com/firefly,https://aitoolsdirectory.com,Generative Art
Frase,"Research keywords, create content briefs and templates, write and optimize your articles. Create custom AI templates and pre-made SEO-focused tools to win at content marketing. Find industry-specific data points relevant to your topic and inject them into relevant content.",https://link.aitoolsdirectory.com/frase,https://aitoolsdirectory.com,Copywriting#writing #assistant
Adobe Podcast,"Tools for professional-quality podcasting without advanced gear or skills. Key features include speech enhancement, mic check, browser-based editing, AI transcription, remote recording, and royalty-free music.",https://link.aitoolsdirectory.com/adobe-podcast,https://aitoolsdirectory.com,Podcasting
Apify,"Apify is a no-code platform that simplifies web scraping for AI model training. It integrates with tools like LangChain and Pinecone, streamlining data collection from the web. This enhances AI efficiency, delivers accurate insights, and supports customized AI tool development.",https://link.aitoolsdirectory.com/apify,https://aitoolsdirectory.com,Productivity#web scraping #API
HEIGHTS AI,"Your course creation copilot. Generate an entire course draft instantly, get catchy title ideas, compelling descriptions, and chat with the AI about improvements, SEO, and growth strategies",https://link.aitoolsdirectory.com/heights,https://aitoolsdirectory.com,Education
Dzine,"Boost creativity and professional visual creation with generative image AI, automation workflows, photo filters, and automatic prompt generation.",https://link.aitoolsdirectory.com/dzine,https://aitoolsdirectory.com,Design Generators
DET Practice,"DET Practice uses AI to provide instant, detailed feedback on Duolingo English Test prep, featuring a massive question bank and adaptive testing system that helps students target their weak spots.",https://link.aitoolsdirectory.com/detpractice,https://aitoolsdirectory.com,Education
OutGrow,"Outgrow's AI Content Maker turns static text into interactive content, such as quizzes and calculators. AI-powered automation personalizes experiences, engages users, and simplifies lead creation.",https://link.aitoolsdirectory.com/outgrow,https://aitoolsdirectory.com,Marketing
JoggAI,"JoggAI transforms product URLs or images into video ads in minutes with AI avatars, pre-built templates, and automated scriptwriting, perfect for small businesses and indie creators on a budget.",https://link.aitoolsdirectory.com/joggai,https://aitoolsdirectory.com,Video Generation
Syllaby,"Syllaby transforms ideas into impactful videos with customizable avatars, voice cloning, and trend-driven scripts, providing an efficient, low-cost solution for businesses aiming to elevate their video marketing.",https://link.aitoolsdirectory.com/syllaby,https://aitoolsdirectory.com,Video Generation
Harpa AI,"HARPA AI is a Chrome extension that brings productivity tools like YouTube summarization, SEO audits, email drafting, and web automation directly into your browser, with a focus on privacy and efficiency.",https://link.aitoolsdirectory.com/harpa,https://aitoolsdirectory.com,Automation
Eagle,"Eagle is an all-in-one asset management tool for creatives, offering AI-driven tools like image enlargement, background removal, and text extraction, plus smart organization with tagging and color filters. Customize workflows, save assets with a browser extension, and streamline collaboration with cloud sync options for efficient content management.",https://link.aitoolsdirectory.com/eagle,https://aitoolsdirectory.com,Productivity
Qodex,"Qodex.ai uses AI to handle API testing and documentation with automation, no-code tools, and real-time monitoring. It’s designed for developers, startups, and non-technical teams looking to improve efficiency.",https://qodex.ai/?via=aitoolsdirectory-com,https://aitoolsdirectory.com,Automation
VideoIdeas.ai,"Powerful tool for creating YouTube scripts, Shorts, and video ad ideas. Suggests topics, analyzes your channel, and generates copy in your preferred tone.",https://www.videoideas.ai/,https://aitoolsdirectory.com,Marketing
Liner,"Liner is an AI-powered research tool for students and professionals, offering transparent answers with citations, source filtering, and access to multiple AI models to streamline your academic and professional projects.",https://link.aitoolsdirectory.com/liner,https://aitoolsdirectory.com,Productivity
Tweet Hunter,"Let AI analyze your tweets, edit content, rewrite winning tweets, and schedule the best stuff on X. Get access to millions of viral tweets, AI-powered content suggestions, an AI lead finder, scheduling and advanced automation tools.",https://link.aitoolsdirectory.com/tweethunter,https://aitoolsdirectory.com,Social Media#twitter
Fellow,"Fellow automates meeting notes, transcribes in 99 languages, and summarizes discussions with AI, offering CRM sync and privacy controls for small teams and solo entrepreneurs.",https://fellow.app/?via=aitoolsdirectory-com,https://aitoolsdirectory.com,Productivity
Hubspot AI,"Hubspot CRM's new AI tools are all about power and efficiency. Optimize content at scale, create new content, discover new leads, perform complex reporting, and write Ogilvy-level marketing campaigns and emails.",https://link.aitoolsdirectory.com/hubspot-ai,https://aitoolsdirectory.com,Marketing#CRM
Super,"Super.so transforms Notion pages into fast, SEO-optimized, no-code websites, with a focus on simplicity and content management for Notion users.",https://link.aitoolsdirectory.com/super,https://aitoolsdirectory.com,Productivity
BatchTable,"BatchTable simplifies image metadata generation with AI-powered automation. Create keywords, titles, and descriptions at scale for your stock photography or marketing workflows.",https://www.batchtable.com/?via=aitoolsdirectory-com,https://aitoolsdirectory.com,Automation
Chance AI,"Chance AI is a visual intelligence app offering AI-powered object recognition and interactive insights for art, travel, food, and more. Accessible and inclusive, it transforms curiosity into knowledge.",https://www.chance.vision/?via=aitoolsdirectory,https://aitoolsdirectory.com,Education
Synthesia,"AI video creation platform that lets you turn documents, PowerPoints, and PDFs into engaging videos. Create your own avatars or choose from 100 realistic avatars, 130 languages, and 55 video templates.",https://link.aitoolsdirectory.com/synthesia,https://aitoolsdirectory.com,Text-to-Video
Hiver,"Summarize emails, suggest response templates, and auto-close conversations with the help of AI. Improve customer support agent efficiency and power up email workflows.",https://link.aitoolsdirectory.com/hiver,https://aitoolsdirectory.com,Productivity
LensGo,LensGo is an AI video styling tool that lets you transform boring videos into epic content with zero editing skills - basically Instagram filters for video on serious creative steroids.,https://lensgo.ai/?sourceSite=seo&sourceName=aitoolsdirectory,https://aitoolsdirectory.com,Generative Video
SEOmatic,"Programmatic content creation for niche site owners, digital agencies, and SaaS startups. SEOmatic's no-code solution simplifies the process of generating SEO-friendly pages on a large scale.",https://link.aitoolsdirectory.com/seomatic,https://aitoolsdirectory.com,SEO#programmatic #copywriting
BetterPic,"If you need professional headshots without the hassle of a studio shoot, BetterPic’s AI Headshot Generator delivers 4K images with over 150 styles in under an hour, with customization options and manual adjustments available.",https://link.aitoolsdirectory.com/betterpic,https://aitoolsdirectory.com,Generative Art
Biread,"BiRead’s AI-powered tool enhances language learning by offering personalized insights, highlighting key phrases, and boosting comprehension.",https://link.aitoolsdirectory.com/biread,https://aitoolsdirectory.com,Education
Magai,"AI productivity tool for small businesses and indie hackers, offering access to multiple AI models, document upload features, YouTube transcript extraction, and more—all in one interface.",https://link.aitoolsdirectory.com/magai,https://aitoolsdirectory.com,Productivity
Coda AI,"With powerful integrations, customizable workflows, and AI-powered features like drafting content and generating tables, Coda AI takes your work to the next level.",https://link.aitoolsdirectory.com/coda,https://aitoolsdirectory.com,Productivity#docs #management
Guidejar,"Create interactive demos and step-by-step guides effortlessly with Guidejar's AI-powered platform. Perfect for enhancing user onboarding, product marketing, and sales enablement.",https://link.aitoolsdirectory.com/guidejar,https://aitoolsdirectory.com,Productivity#userOnboarding
Neuraltext,"Your content marketing toolbox with keyword research, SERP analysis, and writing engine all rolled into one smart package.",https://link.aitoolsdirectory.com/neuraltext,https://aitoolsdirectory.com,Copywriting#writing #assistant
AI Detector Pro,"Free AI content detector from Brandwell helps mitigate the risk of being punished by Google for using AI generated content. Protect yourself with this tool, which uses multiple finely-tuned AI engines, natural language processing, and semantic analysis algorithms.",https://link.aitoolsdirectory.com/brandwell-aidetector,https://aitoolsdirectory.com,AI Detection
Creatify,"Pro-grade marketing videos from a simple product link or text. Enjoy efficient production and customisation of social media, advertising, and marketing videos with a user-friendly platform.",https://link.aitoolsdirectory.com/creatify,https://aitoolsdirectory.com,Advertising
Jupitrr,"Jupitrr AI auto-creates super-relevant B-roll for content marketing videos, e.g stock videos, GIFs, and many more - 10x faster for creators.",https://link.aitoolsdirectory.com/jupitrr,https://aitoolsdirectory.com,Video Generation
Link Whisper AI,"Link Whisper’s AI-powered tool identifies unlinked products in your content, highlighting missed affiliate opportunities in a visual sitemap. With OpenAI integration, it streamlines internal linking for SEO",https://link.aitoolsdirectory.com/linkwhisperai,https://aitoolsdirectory.com,SEO#internalLinking #WordPress
Postwise,"Write, schedule, and optimize posts for X (Twitter) and LinkedIn. Generate engaging content based on your topics and use AI-smart growth tools to boost your followers and reach.",https://link.aitoolsdirectory.com/postwise,https://aitoolsdirectory.com,Social Media#twitter
MimicPC,"MimicPC is a cloud-based AI tool suite offering easy access to powerful AI apps for image generation, facial enhancement, and more. Ideal for creative professionals and small businesses.",https://link.aitoolsdirectory.com/mimicpc,https://aitoolsdirectory.com,Generative Art
GhostContent,"GhostContent repurposes your video and audio into a week’s worth of social posts, blog articles, and more—saving creators time while maintaining a consistent brand voice.",https://link.aitoolsdirectory.com/ghostcontent,https://aitoolsdirectory.com,Content Marketing
TurnCage,"TurnCage is an AI-powered platform that builds professional, SEO-friendly websites for small businesses with no coding required. Simply answer a few questions, and TurnCage handles the rest—from design to secure hosting.",https://turncage.com/,https://aitoolsdirectory.com,
Soundverse,"Soundverse is an AI-powered music generator offering tools like text-to-music, stem separation, and song beat generation, ideal for creators looking to produce high-quality audio content effortlessly.",https://link.aitoolsdirectory.com/soundverse,https://aitoolsdirectory.com,Music
HypeFury,"HypeFury is an X (Twitter) growth tool that acts as a personal assistant, helping you grow and monetize your Twitter audience.",https://link.aitoolsdirectory.com/hypefury,https://aitoolsdirectory.com,Social Media
LearnWorlds AI,"Discover the transformative impact of LearnWorlds' new AI features in refining your course creation process. These tools guide in course layout, stimulate fresh content ideas, amplify learner involvement, and enable a custom learning experience.",https://link.aitoolsdirectory.com/learnworlds-ai,https://aitoolsdirectory.com,Education
HeadshotPro,"HeadshotPro generates professional AI headshots within hours, providing freelancers and remote teams with customizable, brand-ready images for a fraction of traditional photo shoot costs.",,https://aitoolsdirectory.com,Image Editing
Make,"Making's AI Assistant, which understands commands given in natural language, can help techies quickly set up automation scenarios. Get more done with less work and get more done with less work.",https://link.aitoolsdirectory.com/make,https://aitoolsdirectory.com,Automation
Kudra,"Kudra automates data extraction, transforming documents into structured insights quickly and accurately. Ideal for solopreneurs and indie hackers, it streamlines workflows, saving both time and effort. Focus on growth while Kudra handles the data.​⬤",https://link.aitoolsdirectory.com/kudra,https://aitoolsdirectory.com,Business Intelligence
Riverside Audio Transcription,"Riverside's free drag-and-drop transcription tool uses advanced AI from OpenAI to transcribe audio or video files in over 100 languages, with a user-friendly interface capable of processing hour-long interviews in less than 2 minutes",https://link.aitoolsdirectory.com/riverside,https://aitoolsdirectory.com,Audio#podcasting #video
Parliant,"Parliant AI offers AI-driven conversational surveys to gather richer customer feedback through natural language, analyze responses automatically, and extract actionable insights.",https://www.parliant.ai/,https://aitoolsdirectory.com,Business Intelligence
Grammarly,"Grammarly’s powerful AI features can supercharge your writing productivity. Fine-tune your tone, get on-point draft suggestions, rework your content, and create killer email management flows.",https://link.aitoolsdirectory.com/grammarly,https://aitoolsdirectory.com,Productivity
Descript,"Descript's transforms complex audio and video editing into a text-editing task. It can rapidly label speakers, clone voices realistically with Overdub (it removes filler words as well), produce speedy transcripts, remove gaps in recordings without affecting meaning and provide cohesive output by splicing together clips from different sources",https://link.aitoolsdirectory.com/descript,https://aitoolsdirectory.com,Audio
Numerous AI,"Get more done in Google Sheets and Excel with the help of Numerous.ai, an AI-powered plugin. Get an artificial intelligence playground directly in your spreadsheet to help simplify data management, generate content in bulk, and more.",https://link.aitoolsdirectory.com/numerous,https://aitoolsdirectory.com,Productivity
Originality AI,The world's first AI Detector and Plagiarism Checker for content and entire websites. Find out if your content was created using artificial intelligence tools and identify any plagiarism.,https://link.aitoolsdirectory.com/originalityai,https://aitoolsdirectory.com,AI Detection#writing
AITable,"AITable AI, AI-Enhanced data management for modern businessess with customizable workflows, intelligent chat, automated content creation, and advanced customer service tools, aimed at boosting business efficiency and productivity.",https://link.aitoolsdirectory.com/aitable,https://aitoolsdirectory.com,Productivity
Visme AI,"Visme AI integrates AI for seamless design, offering features like text writing, image editing, and text-to-speech conversion. It generates initial designs from prompts and helps create presentations, social media graphics, documents, and print materials quickly and efficiently.",https://link.aitoolsdirectory.com/visme-ai,https://aitoolsdirectory.com,Design Generators
Shortspilot,"Shortspilot automates faceless video creation for TikTok, Instagram, and YouTube, offering fast rendering, precise editing, automated scheduling, and niche selection for effortless viral content production.",https://link.aitoolsdirectory.com/shortspilot,https://aitoolsdirectory.com,Video Generation
Cuppa,"Generate SEO-optimized long-form content without the hefty price tag. Simply plug in, create limitless content, choose from affordable plans, and enjoy personalized support at your fingertips.",https://link.aitoolsdirectory.com/cuppa,https://aitoolsdirectory.com,Copywriting#writing #assistant
X-Design,"Specialist AI tool for product photography. Upload a photo, pick or describe a scene, and X-Design builds polished, pro-quality images—no studio, no Photoshop, no guesswork.",https://www.x-design.com/,https://aitoolsdirectory.com,Image Editing
Dante,"With your unique data as its foundation, this bespoke GPT-4 chatbot can be easily integrated with  your website or social accounts as well as third-party popular applications.",https://link.aitoolsdirectory.com/dante,https://aitoolsdirectory.com,Chat#chatbots #Custom GPT
Olympia,Olympia offers affordable AI-powered virtual consultants to help businesses and solopreneurs boost productivity without the overhead of hiring new staff.,https://link.aitoolsdirectory.com/olympia,https://aitoolsdirectory.com,Productivity
Castmagic,Castmagic converts lengthy audio files into short excerpts that retain the original content's key points. It's particularly helpful for companies trying to grow their business through podcasting and other forms of longform audio content.,https://link.aitoolsdirectory.com/castmagic,https://aitoolsdirectory.com,Podcasting
Speak AI,"Crunch text with AI algorithms. Make smarter decisions based on the insights gleaned from data, whether you're doing qualitative research, academic research, marketing research, competitive analysis or digital marketing.",https://link.aitoolsdirectory.com/speakai,https://aitoolsdirectory.com,Text-to-Voice#audio #analytics
Typefully,"Typefully's Vesper is revolutionizing Twitter content creation with its AI-powered assistance, offering personalized ideas, writing support, and feedback to elevate your tweets and audience engagement.",https://link.aitoolsdirectory.com/typefully,https://aitoolsdirectory.com,Social Media
CodeDesign,"Create and deploy beautiful websites with CodeDesign—a  website builder. Features include real-time collaboration, cloud hosting, supreme SEO capabilities, flexible publishing options, relational database, domain hosting or code export, AI design regeneration, and customization abilities.",https://link.aitoolsdirectory.com/codedesign,https://aitoolsdirectory.com,Automation
Lalal AI,"Cutting-edge vocal removal and music source separation tool for musicians, video editors, marketers, and other people in the creative field. Quick and accurate extraction of vocals, backing, and different instruments from any audio or video.",https://link.aitoolsdirectory.com/lalal,https://aitoolsdirectory.com,Audio
Deciphr,"Deciphr converts audio podcast episodes into shareable content for greater distribution. Get transcripts, summaries, audiograms and more in your unique style for sharing online.",https://link.aitoolsdirectory.com/deciphr,https://aitoolsdirectory.com,Podcasting
Rask,"Rask is an AI-powered platform that makes video localization easy. You can add voiceovers, subtitles, and dubbing in multiple languages with accurate translations, saving time and effort.",https://link.aitoolsdirectory.com/rask,https://aitoolsdirectory.com,Video Editing
Lyro by Tidio,"A unique conversational AI chatbot for customer support like you've never seen it. Faster, less expensive, and better than a human customer support agent.",https://link.aitoolsdirectory.com/tidio,https://aitoolsdirectory.com,Chat
SudoWrite,"Get your novel or screenplay written faster with a data-driven muse. Sudowrite specializes in immersive descriptions, scene expansion, draft completion, and simplifying sentence revisions. Features include voice-matching content generation, grammar check, interactive feedback, word discovery, and planning tools like Canvas.",https://link.aitoolsdirectory.com/sudowrite,https://aitoolsdirectory.com,Copywriting#writing #assistant
RepliQ,RepliQ is an AI-powered video generation tool for cold email outreach and social media prospecting. Generate more meetings with clients by scaling personalized videos and images.,https://link.aitoolsdirectory.com/repliq,https://aitoolsdirectory.com,Marketing
Scribe,"Capture processes and generate shareable step-by-step guides with Scribe, revolutionizing documentation and streamlining business operations.",https://link.aitoolsdirectory.com/scribe,https://aitoolsdirectory.com,Productivity#SOPs #automation
ProWritingAid,"Improve your writing and meet specific writing requirements by using one of seven different types of rephrasing in ProWritingAid's newest AI tool. Easily add sensory language, enhance structure and vocabulary. Make your sentences sound more fluent and native-like.",https://link.aitoolsdirectory.com/prowritingaid-rephrase,https://aitoolsdirectory.com,Copywriting
TeacherMatic,"AI-fueled teacher-designed platform improving education by automating resource generation, lesson planning, and assessment creation, while ensuring quality and relevance.",https://link.aitoolsdirectory.com/teachermatic,https://aitoolsdirectory.com,Education
Plagiashield,"A plagiarism checker with a specialized ChatGPT detection Chrome extension. Monitor thousands of web pages, identify copycats, and generate DMCA notices to remove infringing material instantly.",https://link.aitoolsdirectory.com/plagiashield,https://aitoolsdirectory.com,AI Detection
Wondershare VirtuLook,"VirtuLook is an AI-powered tool that helps businesses create high-quality, realistic product photos without the need for photoshoots or physical models. Use virtual models and AI-generated backgrounds to cut production costs and drive conversions.",https://link.aitoolsdirectory.com/virtulook,https://aitoolsdirectory.com,Graphic Design
Wondershare Virbo,"Transform your storytelling with Virbo's vast selection of AI avatars and voices, perfect for creating engaging videos across any platform.",https://link.aitoolsdirectory.com/virbo,https://aitoolsdirectory.com,Text-to-Video
Codeleaks,"A comprehensive detection tool for AI-generated, plagiarized or modified source codes, offering licensing alerts, proprietary code monitoring, and support for multiple languages. It provides integration with native LMS and has a powerful and customizable API.",https://link.aitoolsdirectory.com/codeleaks,https://aitoolsdirectory.com,Coding
Simplified,"Write unique and best-in-class content for blogs, articles, ads, products and websites in just a few clicks. Create content that converts with 50+ templates.",https://link.aitoolsdirectory.com/simplified,https://aitoolsdirectory.com,Copywriting#writing #assistant
HoppyCopy,Write better emails faster with HoppyCoppy's AI Copy Editor. Generate powerful content for hundreds of campaigns. Get unique ideas and attention-grabbing headlines. Create visually stunning newsletters.,https://link.aitoolsdirectory.com/hoppycopy,https://aitoolsdirectory.com,Marketing
Icon,"Icon is a creative production platform that helps businesses generate static ads, video ads, and UGC at scale for $39/month, replacing tools like Canva, CapCut, and ChatGPT.",https://link.aitoolsdirectory.com/icon,https://aitoolsdirectory.com,Advertising
Jasper,Generate plagiarism-free blog articles and original SEO content. Test instant copy variations to increase sales & social media engagement.,https://link.aitoolsdirectory.com/jasper,https://aitoolsdirectory.com,Copywriting#writing #assistant
Devi AI,"Devi AI captures high-intent leads by monitoring social media. Connect, add keywords, and provide your business details in 30 seconds. Features include AI-powered keyword monitoring, personalized comments and messages, visual content, and 1-click scheduling.",https://link.aitoolsdirectory.com/ddevi,https://aitoolsdirectory.com,Marketing
Voluum,"Boost ROI for Marketers & Agencies with Voluum's Advanced AI Tools: Traffic Distribution, Automated Optimization & Fraud Detection",https://link.aitoolsdirectory.com/voluum,https://aitoolsdirectory.com,Marketing
Neural Love,"Free AI platform for enhancing and generating media. It includes tools for creating art, avatars, uncropping images, enhancing visuals, generating image variations, and improving video and audio quality.",https://link.aitoolsdirectory.com/neurallove,https://aitoolsdirectory.com,Generative Art
Magic Studio,"Create stunning visuals with just a few simple steps with the instant generated profile picture feature, generative image creation, magic eraser tools and smart background eraser.",https://link.aitoolsdirectory.com/magicstudio,https://aitoolsdirectory.com,Generative Art
Creaitor,"Creaitor is a smart AI assistant that can write content for you. It saves you time and gets rid of writer's block! You can use presets to get started or create your own, then let Creaitor do the rest.",https://link.aitoolsdirectory.com/creaitor,https://aitoolsdirectory.com,Copywriting#writing #assistant
Prompt Hunt,"Prompt Hunt, an AI Library, offers 200 marketing prompts to boost productivity and creativity for SEO, email marketing, and social media.",,https://aitoolsdirectory.com,Marketing
